B6: File | C6: Original Size | D6: Compressed Size | E6: Bits Per Byte | F6: Weighted
B7: bib | C7: 111261 | D7: 36594 | E7: =(D7*8)/C7 -> 2.6312184862620325
B8: book1 | C8: 768771 | D8: 335310 | E8: =(D8*8)/C8 -> 3.4893095603242057
B9: book2 | C9: 610856 | D9: 213402 | E9: =(D9*8)/C9 -> 2.7947928808098799
B10: geo | C10: 102400 | D10: 71022 | E10: =(D10*8)/C10 -> 5.5485937500000002
B11: news | C11: 377109 | D11: 142978 | E11: =(D11*8)/C11 -> 3.0331389598232872
B12: obj1 | C12: 21504 | D12: 9982 | E12: =(D12*8)/C12 -> 3.7135416666666665
B13: obj2 | C13: 246814 | D13: 77722 | E13: =(D13*8)/C13 -> 2.519208796907793
B14: paper1 | C14: 53161 | D14: 20014 | E14: =(D14*8)/C14 -> 3.0118319820921351
B15: paper2 | C15: 82199 | D15: 32534 | E15: =(D15*8)/C15 -> 3.1663645543133128
B16: pic | C16: 513216 | D16: 58338 | E16: =(D16*8)/C16 -> 0.90937149270482609
B17: progc | C17: 39611 | D17: 14194 | E17: =(D17*8)/C17 -> 2.8666784479058847
B18: progl | C18: 71646 | D18: 17174 | E18: =(D18*8)/C18 -> 1.9176506713563912
B19: progp | C19: 49379 | D19: 11674 | E19: =(D19*8)/C19 -> 1.8913303226067761
B20: trans | C20: 93695 | D20: 19486 | E20: =(D20*8)/C20 -> 1.6637814184321469
B21: TOTAL: | C21: =SUM(C7:C20) -> 3141622 | D21: =SUM(D7:D20) -> 1060424 | E21: =AVERAGE(E7:E20) -> 2.7969152135860957 | F21: =(D21*8)/C21 -> 2.7003223175798996